{
  "sprint_id": "supervisor-export-20260531-144705",
  "timestamp": "2026-05-31T14:47:05.725745",
  "verdict": "ACCEPTED",
  "source_bundle": "C:\\Users\\prora\\OneDrive\\Documents\\GitHub\\format-factory\\.local\\r83-supervisor-review-package.zip",
  "coordinator_lane": "C0",
  "lanes": [
    {
      "lane_id": "C0",
      "owner_role": "Coordinator",
      "title": "Sprint coordination and integration",
      "description": "Tracks all lanes; owns file ownership matrix; stops on emergency conditions",
      "allowed_files": [
        "reports/rNN/**"
      ],
      "forbidden_files": [
        "AGENTS.md",
        "GOVERNANCE.md",
        "plans/master-plan.md",
        "registry/**",
        "tools/evidence/**",
        "tests/evidence/**"
      ],
      "dependencies": [],
      "tasks": [],
      "status": "pending",
      "non_authoritative": true
    },
    {
      "lane_id": "C1",
      "owner_role": "Governance",
      "title": "Governance discovery",
      "description": "Read-only access to governance files; produces preflight report",
      "allowed_files": [
        "reports/rNN/00-preflight.md"
      ],
      "forbidden_files": [
        "AGENTS.md",
        "GOVERNANCE.md",
        "plans/master-plan.md"
      ],
      "dependencies": [],
      "tasks": [],
      "status": "pending",
      "non_authoritative": true
    },
    {
      "lane_id": "C2",
      "owner_role": "Repair",
      "title": "Contradiction repair",
      "description": "Address any open CRITICAL contradictions from prior sprint",
      "allowed_files": [
        "reports/rNN/**",
        "src/**"
      ],
      "forbidden_files": [
        "AGENTS.md",
        "GOVERNANCE.md",
        "plans/master-plan.md",
        "registry/**"
      ],
      "dependencies": [
        "C0"
      ],
      "tasks": [
        "REPAIR-001"
      ],
      "status": "pending",
      "non_authoritative": true
    },
    {
      "lane_id": "C3",
      "owner_role": "Implementation",
      "title": "Product implementation and taskcard execution",
      "description": "Execute open taskcards; advance gate work per master-plan.md",
      "allowed_files": [
        "src/**",
        "tests/**",
        "reports/rNN/**",
        "taskcards/**"
      ],
      "forbidden_files": [
        "AGENTS.md",
        "GOVERNANCE.md",
        "plans/master-plan.md",
        "registry/**"
      ],
      "dependencies": [
        "C0",
        "C1"
      ],
      "tasks": [],
      "status": "pending",
      "non_authoritative": true
    },
    {
      "lane_id": "C6",
      "owner_role": "Evidence",
      "title": "Evidence bundle",
      "description": "Build and validate evidence bundle",
      "allowed_files": [
        ".local/evidence/**"
      ],
      "forbidden_files": [
        "AGENTS.md",
        "GOVERNANCE.md",
        "plans/master-plan.md",
        "registry/**"
      ],
      "dependencies": [
        "C0",
        "C1",
        "C2",
        "C3"
      ],
      "tasks": [],
      "status": "pending",
      "non_authoritative": true
    }
  ],
  "overlap_check_passed": true,
  "notes": "Generated from evidence review of sprint ** FORMAT-FACTORY-R83-BROAD-PRODUCT-FINISH-REVIEW-PACKAGE-ARTIFACTS-FODS-FODT-NEXTFORMATS-AUTHORITY-MEGA-TRAIN-001"
}